{"$defs":{"artifactReference":{"additionalProperties":false,"properties":{"coordinate":{"$ref":"#/$defs/token"},"digest":{"$ref":"#/$defs/digest"}},"required":["coordinate","digest"],"type":"object"},"digest":{"pattern":"^sha256:[0-9a-f]{64}$","type":"string"},"generator":{"additionalProperties":false,"properties":{"coordinate":{"$ref":"#/$defs/token"},"digest":{"$ref":"#/$defs/digest"},"version":{"$ref":"#/$defs/token"}},"required":["coordinate","version","digest"],"type":"object"},"token":{"minLength":1,"pattern":"^(?!\\s)(?!.*\\s$)[^\\u0000-\\u001f\\u007f-\\u009f]+$","type":"string"}},"$id":"https://wesley.dev/schemas/wesley-generation-review-v2.schema.json","$schema":"https://json-schema.org/draft/2020-12/schema","additionalProperties":false,"properties":{"apiVersion":{"const":"wesley.generation-review/v2"},"authoritative":{"const":false},"emittedArtifacts":{"items":{"$ref":"#/$defs/artifactReference"},"type":"array"},"generationInputDigest":{"$ref":"#/$defs/digest"},"generator":{"$ref":"#/$defs/generator"},"projectionRoles":{"items":{"$ref":"#/$defs/token"},"type":"array","uniqueItems":true},"provenanceManifestDigest":{"$ref":"#/$defs/digest"},"sourceArtifacts":{"items":{"$ref":"#/$defs/artifactReference"},"type":"array"}},"required":["apiVersion","authoritative","generationInputDigest","provenanceManifestDigest","generator","projectionRoles","sourceArtifacts","emittedArtifacts"],"title":"Wesley Generation Review v2","type":"object"}
