{"apiVersion":"wesley.generation-review/v2","authoritative":false,"emittedArtifacts":[{"coordinate":"fixture:generated-profile@1","digest":"sha256:702f5bb0c6d4fbeba4d44b1eab6317a827a915c6e28398ae7742a229592c7899"}],"generationInputDigest":"sha256:17eb58becf030f316d16bf943952cd735a461b21beda58b3641e05c6f60efa8c","generator":{"coordinate":"fixture:semantic-generator@1","digest":"sha256:ed1c605dc5769e8bf31d0e4cf62e4b590b481d6e4b980c1360a246f43a0343f1","version":"1.0.0"},"projectionRoles":["generated-profile"],"provenanceManifestDigest":"sha256:957ee08ab8d27a052bc7f0b537ae4b8eb32ebe14696c42fd2b6427363ba00adc","sourceArtifacts":[{"coordinate":"fixture:semantic-source@1","digest":"sha256:90b878cbd69d5eb0c1673e4ed9652da70d97ff0a6ffbe689a4ec82241a5927ac"}]}
